partition,book
came upon david day forward samuel rose went ramah spirit lord depart saul evil spirit lord troubl saul servant said unto behold evil spirit god troubleth thee let lord command thi servant thee seek man cun player harp shall come pass evil spirit god upon thee shall play hand thou shalt well saul said unto servant provid man play well bring answer one servant said behold seen son jess bethlehemit cun play mighti valiant man man war prudent matter come person lord wherefor saul sent messeng unto jess said send david thi son sheep jess took ass laden bread bottl wine kid sent david son unto saul david came saul stood love greatli becam armourbear saul sent jess say let david pray thee stand hath found favour sight came pass evil spirit god upon saul david took harp play hand saul refresh well evil spirit depart philistin gather togeth armi,bible-kjv.txt
upon wilder consum wrought name sake pollut heathen whose sight brought yet also lift hand unto wilder would bring land given flow milk honey glori land despis judgment walk statut pollut sabbath heart went idol nevertheless mine eye spare destroy neither make end wilder said unto children wilder walk ye statut father neither observ judgment defil idol lord god walk statut keep judgment hallow sabbath shall sign ye may know lord god notwithstand children rebel walk statut neither kept judgment man shall even live pollut sabbath said would pour furi upon accomplish anger wilder nevertheless withdrew mine hand wrought name sake pollut sight heathen whose sight brought forth lift mine hand unto also wilder would scatter among heathen dispers countri execut judgment despis statut pollut sabbath eye father idol wherefor gave also statut good judgment wherebi live pollut gift caus pass fire openeth womb might make desol end might know,bible-kjv.txt
say unto believeth work shall also greater work shall go unto father whatsoev ye shall ask name father may glorifi son ye shall ask thing name ye love keep command pray father shall give anoth comfort may abid ever even spirit truth world receiv seeth neither knoweth ye know dwelleth shall leav comfortless come yet littl world seeth ye see live ye shall live also day ye shall know father ye hath command keepeth loveth loveth shall love father love manifest juda saith unto iscariot lord thou wilt manifest thyself unto us unto world jesu answer said unto man love keep word father love come unto make abod loveth keepeth say word ye hear mine father sent thing spoken unto yet present comfort holi ghost father send name shall teach thing bring thing remembr whatsoev said unto peac leav peac give unto world giveth give unto let heart troubl neither,bible-kjv.txt
priest priest shall valu accord abil vow shall priest valu beast whereof men bring offer unto lord man giveth unto lord shall holi shall alter chang good bad bad good shall chang beast beast exchang thereof shall holi unclean beast offer sacrific unto lord shall present beast priest priest shall valu whether good bad thou valuest art priest shall redeem shall add fifth part thereof unto thi estim man shall sanctifi hous holi unto lord priest shall estim whether good bad priest shall estim shall stand sanctifi redeem hous shall add fifth part money thi estim unto shall man shall sanctifi unto lord part field possess thi estim shall accord seed thereof homer barley seed shall valu fifti shekel silver sanctifi field year jubil accord thi estim shall stand sanctifi field jubil priest shall reckon unto money accord year remain even unto year jubil shall abat thi estim sanctifi field,bible-kjv.txt
shalt also judg hous shalt also keep court give thee place walk among stand hear joshua high priest thou thi fellow sit thee men wonder behold bring forth servant branch behold stone laid joshua upon one stone shall seven eye behold engrav grave thereof saith lord host remov iniqu land one day day saith lord host shall ye call everi man neighbour vine fig tree angel talk came wake man waken sleep said unto seest thou said look behold candlestick gold bowl upon top seven lamp thereon seven pipe seven lamp upon top thereof two oliv tree one upon right side bowl upon left side thereof answer spake angel talk say lord angel talk answer said unto knowest thou said lord answer spake unto say word lord unto zerubbabel say might power spirit saith lord host art thou great mountain zerubbabel thou shalt becom plain shall bring forth headston thereof,bible-kjv.txt
dig wick lord cast peopl neither forsak inherit judgment shall return unto righteous upright heart shall follow rise evildo stand worker iniqu unless lord help soul almost dwelt silenc said foot slippeth thi merci lord held multitud thought within thi comfort delight soul shall throne iniqu fellowship thee frameth mischief law gather togeth soul righteou condemn innoc blood lord defenc god rock refug shall bring upon iniqu shall cut wicked yea lord god shall cut come let us sing unto lord let us make joy nois rock salvat let us come presenc thanksgiv make joy nois unto psalm lord great god great king god hand deep place earth strength hill also sea made hand form dri land come let us worship bow let us kneel lord maker god peopl pastur sheep hand day ye hear voic harden heart provoc day temptat wilder father tempt prove saw work forti year long,bible-kjv.txt
place whither ye sold return recomp upon head sell son daughter hand children judah shall sell sabean peopl far lord hath spoken proclaim ye among gentil prepar war wake mighti men let men war draw near let come beat plowshar sword pruninghook spear let weak say strong assembl come ye heathen gather togeth round thither caus thi mighti one come lord let heathen waken come valley jehoshaphat sit judg heathen round put ye sickl harvest ripe come get press full fat overflow wicked great multitud multitud valley decis day lord near valley decis sun moon shall darken star shall withdraw shine lord also shall roar zion utter voic jerusalem heaven earth shall shake lord hope peopl strength children israel shall ye know lord god dwell zion holi mountain shall jerusalem holi shall stranger pass shall come pass day mountain shall drop new wine hill shall flow milk river judah shall,bible-kjv.txt
children judah daniel hananiah mishael azariah unto princ eunuch gave name gave unto daniel name belteshazzar hananiah shadrach mishael meshach azariah abednego daniel purpos heart would defil portion king meat wine drank therefor request princ eunuch might defil god brought daniel favour tender love princ eunuch princ eunuch said unto daniel fear lord king hath appoint meat drink see face wors like children sort shall ye make endang head king said daniel melzar princ eunuch set daniel hananiah mishael azariah prove thi servant beseech thee ten day let give us puls eat water drink let counten look upon thee counten children eat portion king meat thou seest deal thi servant consent matter prove ten day end ten day counten appear fairer fatter flesh children eat portion king meat thu melzar took away portion meat wine drink gave puls four children god gave knowledg skill learn wisdom daniel understand vision dream,bible-kjv.txt
thi seed shall famili earth bless behold thee keep thee place whither thou goest bring thee land leav thee done spoken thee jacob awak sleep said sure lord place knew afraid said dread place none hous god gate heaven jacob rose earli morn took stone put pillow set pillar pour oil upon top call name place bethel name citi call luz first jacob vow vow say god keep way go give bread eat raiment put come father hous peac shall lord god stone set pillar shall god hous thou shalt give sure give tenth unto thee jacob went journey came land peopl east look behold well field lo three flock sheep lie well water flock great stone upon well mouth thither flock gather roll stone well mouth water sheep put stone upon well mouth place jacob said unto brethren whenc ye said haran said unto know ye laban son nahor,bible-kjv.txt
shall unpunish speaketh lie shall perish delight seemli fool much less servant rule princ discret man deferreth anger glori pass transgress king wrath roar lion favour dew upon grass foolish son calam father content wife continu drop hous rich inherit father prudent wife lord sloth casteth deep sleep idl soul shall suffer hunger keepeth command keepeth soul despiseth way shall die hath piti upon poor lendeth unto lord hath given pay chasten thi son hope let thi soul spare cri man great wrath shall suffer punish thou deliv yet thou must hear counsel receiv instruct thou mayest wise thi latter end mani devic man heart nevertheless counsel lord shall stand desir man kind poor man better liar fear lord tendeth life hath shall abid satisfi shall visit evil sloth man hideth hand bosom much bring mouth smite scorner simpl bewar reprov one hath understand understand knowledg wasteth father chaseth away,bible-kjv.txt
princ saviour give repent israel forgiv sin wit thing also holi ghost god hath given obey heard cut heart took counsel slay stood one council pharise name gamaliel doctor law reput among peopl command put apostl forth littl space said unto ye men israel take heed ye intend touch men day rose theuda boast somebodi number men four hundr join slain mani obey scatter brought nought man rose juda galile day tax drew away much peopl also perish even mani obey dispers say unto refrain men let alon counsel work men come nought god ye overthrow lest hapli ye found even fight god agre call apostl beaten command speak name jesu let go depart presenc council rejoic count worthi suffer shame name daili templ everi hous ceas teach preach jesu christ day number discipl multipli aros murmur grecian hebrew widow neglect daili ministr twelv call multitud discipl unto said reason,bible-kjv.txt
agat thi gate carbuncl thi border pleasant stone thi children shall taught lord great shall peac thi children righteous shalt thou establish thou shalt far oppress thou shalt fear terror shall come near thee behold shall sure gather togeth whosoev shall gather togeth thee shall fall thi sake behold creat smith bloweth coal fire bringeth forth instrument work creat waster destroy weapon form thee shall prosper everi tongu shall rise thee judgment thou shalt condemn heritag servant lord righteous saith lord ho everi one thirsteth come ye water hath money come ye buy eat yea come buy wine milk without money without price wherefor ye spend money bread labour satisfieth hearken dilig unto eat ye good let soul delight fat inclin ear come unto hear soul shall live make everlast coven even sure merci david behold given wit peopl leader command peopl behold thou shalt call nation thou knowest nation,bible-kjv.txt
milcah daughter haran father milcah father iscah sarai barren child terah took abram son lot son haran son son sarai daughter law son abram wife went forth ur chalde go land canaan came unto haran dwelt day terah two hundr five year terah die haran lord said unto abram get thee thi countri thi kindr thi father hous unto land shew thee make thee great nation bless thee make thi name great thou shalt bless bless bless thee curs curseth thee thee shall famili earth bless abram depart lord spoken unto lot went abram seventi five year old depart haran abram took sarai wife lot brother son substanc gather soul gotten haran went forth go land canaan land canaan came abram pass land unto place sichem unto plain moreh canaanit land lord appear unto abram said unto thi seed give land build altar unto lord appear unto remov thenc unto,bible-kjv.txt
rain day propheci power water turn blood smite earth plagu often shall finish testimoni beast ascendeth bottomless pit shall make war shall overcom kill dead bodi shall lie street great citi spiritu call sodom egypt also lord crucifi peopl kindr tongu nation shall see dead bodi three day half shall suffer dead bodi put grave dwell upon earth shall rejoic make merri shall send gift one anoth two prophet torment dwelt earth three day half spirit life god enter stood upon feet great fear fell upon saw heard great voic heaven say unto come hither ascend heaven cloud enemi beheld hour great earthquak tenth part citi fell earthquak slain men seven thousand remnant affright gave glori god heaven second woe past behold third woe cometh quickli seventh angel sound great voic heaven say kingdom world becom kingdom lord christ shall reign ever ever four twenti elder sat god seat fell,bible-kjv.txt
rise dead mean ask say say scribe elia must first come answer told elia verili cometh first restoreth thing written son man must suffer mani thing set nought say unto elia inde come done unto whatsoev list written came discipl saw great multitud scribe question straightway peopl beheld greatli amaz run salut ask scribe question ye one multitud answer said master brought unto thee son hath dumb spirit wheresoev taketh teareth foameth gnasheth teeth pineth away spake thi discipl cast could answereth saith faithless gener long shall long shall suffer bring unto brought unto saw straightway spirit tare fell ground wallow foam ask father long ago sinc came unto said child ofttim hath cast fire water destroy thou canst thing compass us help us jesu said unto thou canst believ thing possibl believeth straightway father child cri said tear lord believ help thou mine unbelief jesu saw peopl came run,bible-kjv.txt
smoke nostril fire mouth devour coal kindl bow heaven also came dark feet rode upon cherub fli seen upon wing wind made dark pavilion round dark water thick cloud sky bright coal fire kindl lord thunder heaven high utter voic sent arrow scatter lightn discomfit channel sea appear foundat world discov rebuk lord blast breath nostril sent took drew mani water deliv strong enemi hate strong prevent day calam lord stay brought forth also larg place deliv delight lord reward accord righteous accord clean hand hath recompens kept way lord wickedli depart god judgment statut depart also upright kept mine iniqu therefor lord hath recompens accord righteous accord clean eye sight merci thou wilt shew thyself merci upright man thou wilt shew thyself upright pure thou wilt shew thyself pure froward thou wilt shew thyself unsavouri afflict peopl thou wilt save thine eye upon haughti thou mayest bring thou art,bible-kjv.txt
set graven imag grove made hous lord said david solomon son hous jerusalem chosen tribe israel put name ever neither make feet israel move land gave father observ accord command accord law servant mose command hearken manasseh seduc evil nation lord destroy children israel lord spake servant prophet say manasseh king judah hath done abomin hath done wickedli amorit hath made judah also sin idol therefor thu saith lord god israel behold bring evil upon jerusalem judah whosoev heareth ear shall tingl stretch jerusalem line samaria plummet hous ahab wipe jerusalem man wipeth dish wipe turn upsid forsak remnant mine inherit deliv hand enemi shall becom prey spoil enemi done evil sight provok anger sinc day father came forth egypt even unto day moreov manasseh shed innoc blood much till fill jerusalem one end anoth besid sin wherewith made judah sin evil sight lord rest act manasseh sin sin written,bible-kjv.txt
fled went egypt jehoiakim king sent men egypt name elnathan son achbor certain men egypt fetch forth urijah egypt brought unto jehoiakim king slew sword cast dead bodi grave common peopl nevertheless hand ahikam son shaphan jeremiah give hand peopl put death begin reign jehoiakim son josiah king judah came word unto jeremiah lord say thu saith lord make thee bond yoke put upon thi neck send king edom king moab king ammonit king tyru king zidon hand messeng come jerusalem unto zedekiah king judah command say unto master thu saith lord host god israel thu shall ye say unto master made earth man beast upon ground great power outstretch arm given unto seem meet unto given land hand nebuchadnezzar king babylon servant beast field given also serv nation shall serv son son son time land come mani nation great king shall serv shall come pass nation kingdom serv nebuchadnezzar,bible-kjv.txt
depart day lead way neither pillar fire night shew light way wherein go thou gavest also thi good spirit instruct withheldest thi manna mouth gavest water thirst yea forti year didst thou sustain wilder lack noth cloth wax old feet swell moreov thou gavest kingdom nation didst divid corner possess land sihon land king heshbon land og king bashan children also multipliedst thou star heaven broughtest land concern thou hadst promis father go possess children went possess land thou subduedst inhabit land canaanit gavest hand king peopl land might would took strong citi fat land possess hous full good well dig vineyard oliveyard fruit tree abund eat fill becam fat delight thi great good nevertheless disobedi rebel thee cast thi law behind back slew thi prophet testifi turn thee wrought great provoc therefor thou deliveredst hand enemi vex time troubl cri unto thee thou heardest heaven accord thi manifold merci,bible-kjv.txt
gave thee said unto thee set thee cook took shoulder upon set saul samuel said behold left set thee eat unto time hath kept thee sinc said invit peopl saul eat samuel day come high place citi samuel commun saul upon top hous aros earli came pass spring day samuel call saul top hous say may send thee away saul aros went samuel abroad go end citi samuel said saul bid servant pass us pass stand thou still may shew thee word god samuel took vial oil pour upon head kiss said lord hath anoint thee captain inherit thou art depart day thou shalt find two men rachel sepulchr border benjamin zelzah say unto thee ass thou wentest seek found lo thi father hath left care ass sorroweth say shall son shalt thou go forward thenc thou shalt come plain tabor shall meet thee three men go god bethel one,bible-kjv.txt
separ lift thine eye look place thou art northward southward eastward westward land thou seest thee give thi seed ever make thi seed dust earth man number dust earth shall thi seed also number aris walk land length breadth give unto thee abram remov tent came dwelt plain mamr hebron built altar unto lord came pass day amraphel king shinar arioch king ellasar chedorlaom king elam tidal king nation made war bera king sodom birsha king gomorrah shinab king admah shemeb king zeboiim king bela zoar join togeth vale siddim salt sea twelv year serv chedorlaom thirteenth year rebel fourteenth year came chedorlaom king smote rephaim ashteroth karnaim zuzim ham emin shaveh kiriathaim horit mount seir unto elparan wilder return came enmishpat kadesh smote countri amalekit also amorit dwelt hazezontamar went king sodom king gomorrah king admah king zeboiim king bela zoar join battl vale siddim chedorlaom king elam tidal,bible-kjv.txt
israel plain moab jordan near jericho fifth book mose call deuteronomi word mose spake unto israel side jordan wilder plain red sea paran tophel laban hazeroth dizahab eleven day journey horeb way mount seir unto kadeshbarnea came pass fortieth year eleventh month first day month mose spake unto children israel accord unto lord given command unto slain sihon king amorit dwelt heshbon og king bashan dwelt astaroth edrei side jordan land moab began mose declar law say lord god spake unto us horeb say ye dwelt long enough mount turn take journey go mount amorit unto place nigh thereunto plain hill vale south sea side land canaanit unto lebanon unto great river river euphrat behold set land go possess land lord sware unto father abraham isaac jacob give unto seed spake unto time say abl bear alon lord god hath multipli behold ye day star heaven multitud lord god father,bible-kjv.txt
thee one priest offic may eat piec bread child samuel minist unto lord eli word lord preciou day open vision came pass time eli laid place eye began wax dim could see ere lamp god went templ lord ark god samuel laid sleep lord call samuel answer ran unto eli said thou calledst said call lie went lay lord call yet samuel samuel aros went eli said thou didst call answer call son lie samuel yet know lord neither word lord yet reveal unto lord call samuel third time aros went eli said thou didst call eli perceiv lord call child therefor eli said unto samuel go lie shall call thee thou shalt say speak lord thi servant heareth samuel went lay place lord came stood call time samuel samuel samuel answer speak thi servant heareth lord said samuel behold thing israel ear everi one heareth shall tingl day perform,bible-kjv.txt
us king priest unto god father glori dominion ever ever amen behold cometh cloud everi eye shall see also pierc kindr earth shall wail even amen alpha omega begin end saith lord come almighti john also brother companion tribul kingdom patienc jesu christ isl call patmo word god testimoni jesu christ spirit lord day heard behind great voic trumpet say alpha omega first last thou seest write book send unto seven church asia unto ephesu unto smyrna unto pergamo unto thyatira unto sardi unto philadelphia unto laodicea turn see voic spake turn saw seven golden candlestick midst seven candlestick one like unto son man cloth garment foot girt pap golden girdl head hair white like wool white snow eye flame fire feet like unto fine brass burn furnac voic sound mani water right hand seven star mouth went sharp twoedg sword counten sun shineth strength saw fell feet dead laid,bible-kjv.txt
bind thi maiden shall companion make banquet shall part among merchant canst thou fill skin barb iron head fish spear lay thine hand upon rememb battl behold hope vain shall one cast even sight none fierc dare stir abl stand hath prevent repay whatsoev whole heaven mine conceal part power come proport discov face garment come doubl bridl open door face teeth terribl round scale pride shut togeth close seal one near anoth air come join one anoth stick togeth sunder nees light doth shine eye like eyelid morn mouth go burn lamp spark fire leap nostril goeth smoke seeth pot caldron breath kindleth coal flame goeth mouth neck remaineth strength sorrow turn joy flake flesh join togeth firm move heart firm stone yea hard piec nether millston raiseth mighti afraid reason break purifi sword layeth hold spear dart habergeon esteemeth iron straw brass rotten wood arrow make flee slingston,bible-kjv.txt
thirti year old upward even unto fifti year old everi one entereth servic work tabernacl congreg even number throughout famili hous father two thousand six hundr thirti number famili son gershon might servic tabernacl congreg mose aaron number accord command lord number famili son merari throughout famili hous father thirti year old upward even unto fifti year old everi one entereth servic work tabernacl congreg even number famili three thousand two hundr number famili son merari mose aaron number accord word lord hand mose number levit mose aaron chief israel number famili hous father thirti year old upward even unto fifti year old everi one came servic ministri servic burden tabernacl congreg even number eight thousand five hundr fourscor accord command lord number hand mose everi one accord servic accord burden thu number lord command mose lord spake unto mose say command children israel put camp everi leper everi one,bible-kjv.txt
know lord go forth prepar morn shall come unto us rain latter former rain unto earth ephraim shall unto thee judah shall unto thee good morn cloud earli dew goeth away therefor hew prophet slain word mouth thi judgment light goeth forth desir merci sacrific knowledg god burnt offer like men transgress coven dealt treacher gilead citi work iniqu pollut blood troop robber wait man compani priest murder way consent commit lewd seen horribl thing hous israel whoredom ephraim israel defil also judah hath set harvest thee return captiv peopl would heal israel iniqu ephraim discov wicked samaria commit falsehood thief cometh troop robber spoileth without consid heart rememb wicked do beset face make king glad wicked princ lie adulter oven heat baker ceaseth rais hath knead dough leaven day king princ made sick bottl wine stretch hand scorner made readi heart like oven while lie wait baker sleepeth night,bible-kjv.txt
wine doth burst bottl wine spill bottl mar new wine must put new bottl came pass went corn field sabbath day discipl began went pluck ear corn pharise said unto behold sabbath day law said unto ye never read david need hungr went hous god day abiathar high priest eat shewbread law eat priest gave also said unto sabbath made man man sabbath therefor son man lord also sabbath enter synagogu man wither hand watch whether would heal sabbath day might accus saith unto man wither hand stand forth saith unto law good sabbath day evil save life kill held peac look round anger griev hard heart saith unto man stretch forth thine hand stretch hand restor whole pharise went forth straightway took counsel herodian might destroy jesu withdrew discipl sea great multitud galile follow judaea jerusalem idumaea beyond jordan tyre sidon great multitud heard great thing came unto spake,bible-kjv.txt
man inherit inherit yonder side jordan forward inherit fallen us side jordan eastward mose said unto ye thing ye go arm lord war go arm jordan lord hath driven enemi land subdu lord afterward ye shall return guiltless lord israel land shall possess lord ye behold ye sin lord sure sin find build citi littl one fold sheep hath proceed mouth children gad children reuben spake unto mose say thi servant lord commandeth littl one wive flock cattl shall citi gilead thi servant pass everi man arm war lord battl lord saith concern mose command eleazar priest joshua son nun chief father tribe children israel mose said unto children gad children reuben pass jordan everi man arm battl lord land shall subdu ye shall give land gilead possess pass arm shall possess among land canaan children gad children reuben answer say lord hath said unto thi servant pass arm lord,bible-kjv.txt
