partition,book
pick darn tablecloth went look knew isnt snobberi well say good old famili youll understand necessari part stori inde chief danger brother highanddri notion nobless oblig well name christabel carstair father colonel carstair youv probabl heard made famou carstair collect roman coin could never describ father nearest say like roman coin handsom genuin valuabl metal outofd prouder collect coatofarm nobodi could say extraordinari charact came two son one daughter quarrel one son brother gile sent australia small allow made leav carstair collect actual yet smaller allow brother arthur meant reward highest honour could offer acknowledg arthur loyalti rectitud distinct alreadi gain mathemat econom cambridg left practic pretti larg fortun sure meant contempt arthur may say might well complain arthur father though differ father earli youth sooner taken collect becam like pagan priest dedic templ mix roman halfpenc honour carstair famili stiff idolatr way father act roman money must guard roman,chesterton-brown.txt
laurel fire look like seem rather odd said flambeau exactli confirm old legend ah repli sceptic travel dont know much old legend may made old figur besid isnt old legend fanshaw fond thing tell version tale much horribl one one stori credit unfortun ancestor spaniard cut two fit pretti pictur also anoth obligingli credit famili possess tower full snake explain littl wriggli thing way third theori suppos crook line ship convention thunderbolt alon serious examin would show littl way unhappi coincid realli go mean ask fanshaw happen repli host coolli thunder lightn two three shipwreck know famili oh said father brown jump littl tabl anoth silenc heard continu murmur river fanshaw said doubt perhap disappoint tone dont think anyth tale tower flame tale cours said admir shrug shoulder dont deni evid decent one ever get thing someon saw blaze hereabout dont know walk home wood someon keep sheep upland inland,chesterton-brown.txt
somehow fanci either symbol delus diseas someth anoth tradit say cavali jame began wear hair long cover ear first lord exmoor also doubt fanci reason point seem make mistak attack aristocraci entir champagn diamond men rather admir nob good time think surrend much admit aristocraci made even aristocrat happi suggest seri articl point dreari inhuman downright diabolist smell atmospher great hous plenti instanc couldnt begin better one ear eyr end week think get truth ityour ever franci finn mr nutt reflect moment stare left boot call strong loud entir lifeless voic everi syllabl sound alik miss barlow take letter mr finn pleas dear finni think would copi reach us second post saturdayyour e nutt elabor epistl articul one word miss barlow rattl one word took anoth strip proof blue pencil alter word supernatur word marvel express shoot express repress happi health activ mr nutt disport ensu saturday found desk dictat,chesterton-brown.txt
whole life overshadow silkhat spectr mr glass two voic ask maggi stare never heard ventriloquist ask father brown dont know speak first natur voic answer shrill squeaki unnatur voic heard long silenc dr hood regard littl man spoken dark attent smile certainli ingeni person said could done better book one part mr glass succeed explain away name miss macnab distinctli heard address mr todhunt rev mr brown broke rather childish giggl well said that silliest part whole silli stori juggl friend threw three glass turn count aloud caught also comment aloud fail catch realli said one two threemiss glass one twomiss glass second still room everyon one accord burst laugh figur corner complac uncoil rope let fall flourish advanc middl room bow produc pocket big bill print blue red announc zaladin world greatest conjur contortionist ventriloquist human kangaroo would readi entir new seri trick empir pavilion scarborough monday next eight,chesterton-brown.txt
open door brief dignifi mr boulnoi ask offer apolog sir said oblig go suddenli see appoint said interview rise voic know went pendragon park sir said servant rather sombr began close door kidd start littl go mrswith rest parti ask rather vagu sir said man shortli stay behind went alon shut door brutal air duti done american curiou compound impud sensit annoy felt strong desir hustl along bit teach busi habit hoari old dog grizzl heavyfac old butler prehistor shirtfront drowsi old moon scatterbrain old philosoph couldnt keep appoint that way goe deserv lose wife purest devot said mr calhoun kidd perhap he gone make row case reckon man western sun spot turn corner open lodgeg set stump long avenu black pinewood point abrupt perspect toward inner garden pendragon park tree black orderli plume upon hears still star man literari direct natur associ word ravenswood came head repeatedli partli raven,chesterton-brown.txt
sort peopl await examin think alreadi less made mind clear thing someth like confess turn began say low voic oh cant stick must know instant one poor women sit long bench stood scream aloud point finger never life heard anyth demoniac distinct lean finger seem pick peashoot though word mere howl everi syllabl clear separ stroke clock drugger davi shout theyv got drugger davi among wretch women mostli thiev streetwalk twenti face turn gape glee hate never heard word known shock upon featur socal oscar rian heard real name im quit ignor may surpris hear drugger davi one terribl deprav crimin ever baffl polic certain done murder long last exploit warder never entir fix curious enough manner milderor meanercrim fix pretti often handsom wellbredlook brute still extent use mostli go barmaid shopgirl money often though went good deal farther found drug cigarett chocol whole properti miss came one case girl,chesterton-brown.txt
munch piec bread sip left untast tumbler cold water talk howev exuber ill tell ill cri ill mix salad cant eat ill mix like angel youv got lettuc unfortun thing got answer goodhumour major must rememb mustard vinegar oil vanish cruet burglar know repli brown rather vagu that ive alway afraid would happen that alway carri cruetstand im fond salad amaz two men took pepperpot waistcoat pocket put tabl wonder burglar want mustard went take mustardpot anoth pocket mustard plaster suppos vinegarand produc condiment havent heard someth vinegar brown paper oil think put left garrul instant arrest lift eye saw one els sawth black figur dr oman stand sunlit lawn look steadili room could quit recov cray cloven your astound card said stare shall come hear sermon theyr amus manner voic chang littl lean back chair oh sermon cruetstand said father brown quit grave heard faith like grain mustardse chariti,chesterton-brown.txt
odd nois might mean grey skylin brighten silver broaden light realiz hous belong angloindian major name putnam major nativ cook malta communion also began rememb pistolshot sometim seriou thing accompani consequ legitim concern turn back went garden gate make front door halfway one side hous stood project like low shed afterward discov larg dustbin round corner came figur first mere shadow haze appar bend peer come nearer solidifi figur inde rather unusu solid major putnam baldhead bullneck man short broad one rather apoplect face produc prolong attempt combin orient climat occident luxuri face goodhumour one even though evid puzzl inquisit wore kind innoc grin larg palmleaf hat back head suggest halo mean appropri face otherwis clad vivid suit stripe scarlet yellow pyjama though glow enough behold must fresh morn pretti chilli wear evid come hous hurri priest surpris call without ceremoni hear nois ye answer father brown thought better look,chesterton-brown.txt
passag two men appear simultan two end sort passag run along side apollo theatr adelphi even daylight street larg lumin opalesc empti passag compar long dark man could see mere black silhouett end nevertheless man knew even inki outlin men strike appear hate cover passag open one end one steep street adelphi terrac overlook sunsetcolour river one side passag blank wall build support old unsuccess theatr restaur shut side passag contain two door one end neither commonli call stage door sort special privat stage door use special perform case star actor actress shakespearean perform day person emin often like privat exit entranc meet friend avoid two men question certainli two friend men evid knew door count open approach door upper end equal cool confid howev equal speed man walk fast man end tunnel arriv secret stage door almost instant salut civil wait moment one sharper walker seem shorter patienc knock,chesterton-brown.txt
realli defend poor duke give away didnt ever hear time nearli lost estat priest shook head librarian proceed tell tale heard predecessor post patron instructor seem trust implicitli certain point common enough tale declin great famili fortunesth tale famili lawyer lawyer howev sens cheat honestli express explain instead use fund held trust took advantag duke careless put famili financi hole might necessari duke let hold realiti lawyer name isaac green duke alway call elisha presum refer fact quit bald though certainli thirti risen rapidli dirti begin first nark inform moneylend solicitor eyr sens say keep technic straight readi deal final blow blow fell dinner old librarian said never forget look lampshad decant littl lawyer steadi smile propos great landlord halv estat sequel certainli could overlook duke dead silenc smash decant man bald head suddenli seen smash glass day orchard left red triangular scar scalp lawyer eye alter smile rose totter,chesterton-brown.txt
alway handsom beauti air tint structur head featur though yet middleag auburn hair titianesqu full form colour look mouth around eye suggest sorrow wast wind wast last edg greek templ inde littl domest difficulti speak decis rather comic tragic father brown gather cours convers cray gourmet leav usual lunchtim putnam host done final feast old croni arrang special dejeun set consum cours morn audrey graver person morn servic go escort rel old friend dr oliv oman though scientif man somewhat bitter type enthusiast music would go even church get noth could conceiv concern tragedi miss watson face half consciou instinct father brown turn seem lunat grub grass stroll across black unbrush head lift abruptli surpris continu presenc inde father brown reason best known linger much longer polit requir even ordinari sens permit well cri cray wild eye suppos think im mad like rest consid thesi answer littl man composedli inclin,chesterton-brown.txt
bruno produc particularli poetic fantast interpret midsumm night dream artist promin given oberon titania word bruno set dreami exquisit sceneri move mystic danc green costum like burnish beetlew express elus individu elfin queen person confront still broad daylight man look woman face greet men beam baffl smile kept mani male danger distanc accept flower cutler tropic expens victori anoth sort present sir wilson seymour offer later nonchalantli gentleman breed show eager convent unconvention give anyth obviou flower pick trifl said rather curios ancient greek dagger mycenaean epoch might well worn time theseu hippolyta made brass like heroic weapon oddli enough sharp enough prick anyon still realli attract leaflik shape perfect greek vase interest miss rome could come anywher play hope would inner door burst open big figur appear contrast explanatori seymour even captain cutler nearli sixfootsix theatric thew muscl isidor bruno gorgeou leopard skin goldenbrown garment oberon look like barbar,chesterton-brown.txt
larg take church close larger book seem faintest touch hurri embarrass suppos said priest seem anxiou chang subject spear thing india everywher answer doctor putnam old soldier mexico australia cannib island know hope cannib island said brown learnt art cookeri ran eye stewpot strang utensil wall moment jolli subject convers thrust laugh lobsterish face room come along cray cri lunch come bell ring want go church cray slip upstair chang dr oman miss watson betook solemnli street string churchgoer father brown notic doctor twice look back scrutin hous even came back corner street look priest look puzzl cant dustbin mutter cloth earlier today father brown touch peopl sensit baromet today seem sensit rhinocero social law rigid impli could suppos linger round lunch angloindian friend linger cover posit torrent amus quit needless convers puzzl seem want lunch one anoth exquisit balanc kedgere curri accompani appropri vintag laid two repeat one fastday,chesterton-brown.txt
least blade short wound heart die instantli doctor first saw could hardli dead twenti minut therefor father brown found could hardli dead three offici detect evid follow chiefli concern presenc absenc proof struggl suggest tear dress shoulder seem fit particularli well direct final blow detail suppli though explain first import wit call sir wilson seymour gave evid everyth els allnot well perfectli though much public man judg convey exactli fine shade selfeffac king justic though everyon look would prime minist archbishop canterburi could said noth part privat gentleman accent noun also refreshingli lucid committe call miss rome theatr met captain cutler join short time accus return dressingroom join roman cathol priest ask deceas ladi said name brown miss rome gone outsid theatr entranc passag order point captain cutler flowershop buy flower wit remain room exchang word priest distinctli heard deceas sent captain errand turn round laugh run passag toward end,chesterton-brown.txt
munch piec bread sip left untast tumbler cold water talk howev exuber ill tell ill cri ill mix salad cant eat ill mix like angel youv got lettuc unfortun thing got answer goodhumour major must rememb mustard vinegar oil vanish cruet burglar know repli brown rather vagu that ive alway afraid would happen that alway carri cruetstand im fond salad amaz two men took pepperpot waistcoat pocket put tabl wonder burglar want mustard went take mustardpot anoth pocket mustard plaster suppos vinegarand produc condiment havent heard someth vinegar brown paper oil think put left garrul instant arrest lift eye saw one els sawth black figur dr oman stand sunlit lawn look steadili room could quit recov cray cloven your astound card said stare shall come hear sermon theyr amus manner voic chang littl lean back chair oh sermon cruetstand said father brown quit grave heard faith like grain mustardse chariti,chesterton-brown.txt
rotten test sure insist flambeau might point pretti straight someth there disadvantag stick point straight answer end stick alway point opposit way depend whether get hold stick right end saw thing done ive never believ sinc proceed tell stori disillusion happen nearli twenti year chaplain coreligionist prison chicagowher irish popul display capac crime penit kept toler busi offici secondincommand governor exdetect name greywood usher cadaver carefulspoken yanke philosoph occasion vari rigid visag odd apologet grimac like father brown slightli patron way father brown like though heartili dislik theori theori extrem complic held extrem simplic one even sent priest accord custom took seat silenc tabl pile litter paper wait offici select paper scrap newspap cut hand across cleric read grave appear extract one pinkest american societi paper ran follow societi brightest widow freak dinner stunt exclus citizen recal perambul parad dinner lasttrick todd palati home pilgrim pond caus mani promin debutant,chesterton-brown.txt
realli caught fire spark horizon alway look like twin light coast lighthous said flambeau father brother die wick uncl legend nearli got estat father brown answer inde speak save civil till safe round cigarbox cabin yacht saw frustrat fire extinguish refus linger though actual heard young pendragon escort enthusiast crowd come tramp river bank might move romant curios receiv combin thank man ship girl cano fatigu fallen start flambeau abruptli told drop cigarash trouser that cigarash said rather wearili that fire dont think your smoke cigar that way got first faint suspicion chart mean pendragon chart pacif island ask fanshaw thought chart pacif island answer brown put feather fossil bit coral everyon think specimen put feather ribbon artifici flower everyon think ladi hat put feather inkbottl book stack writingpap men swear theyv seen quill pen saw map among tropic bird shell thought map pacif island map river know ask fanshaw,chesterton-brown.txt
electrifi eye upon friend fanshaw said rather absent well nobodi kill anyhow rather curiou kind tower observ father brown take kill peopl alway kill peopl somewher els instant monstrou figur garden stream beard stood green ridg sky wave other come wave rake cutlass behind came two negro also old crook cutlass trophi bloodr glare black face yellow figur look like devil carri instrument tortur dim garden behind distant voic heard call brief direct priest heard voic terribl chang came counten remain compos never took eye patch flame begun spread seem shrink littl hiss torch long silver spear water kept finger along nozzl pipe ensur aim attend busi know nois semiconsci corner eye excit incid began tumbl island garden gave two brief direct friend one knock fellow somehow tie whoever there rope faggot want take away nice hose soon get chanc call cano girl she bank gipsi ask could get bucket,chesterton-brown.txt
stump straight broad step didnt know pugil latest hobbi go see fight dont think fight repli father brown pass rapidli anteroom inner room pass hall combat rais rope pad innumer seat box still cleric look round paus till came clerk desk outsid door mark committe stop ask see lord pooley attend observ lordship busi fight come soon father brown goodtemp tedium reiter offici mind gener prepar moment rather baffl flambeau found presenc man still shout direct anoth man go room care know rope fourth well want wonder lord pooley gentleman like remain race worriedespeci money half grey half flaxen eye fever highbridg frostbitten nose word said father brown come prevent man kill lord pooley bound chair spring flung im damn ill stand cri committe parson petit werent parson old day fought without glove theyr fight regul glove there rag possibl either boxer kill didnt mean either boxer said littl priest,chesterton-brown.txt
convict escap ran dawn morn shout help heard convict settlement sequah state author hurri direct cri found corps warder patrol top north wall prison steepest difficult exit one man alway found suffici unfortun offic howev hurl high wall brain beaten club gun miss inquiri show one cell empti occupi rather sullen ruffian give name oscar rian temporarili detain compar trivial assault gave everyon impress man black past danger futur final daylight bad fulli reveal scene murder found written wall bodi fragmentari sentenc appar finger dip blood selfdef gun meant harm man one keep bullet pilgrim pondor man must use fiendish treacheri savag amaz bodili dare storm wall spite arm man well literari style somewhat improv admit priest cheer still dont see cut poor figur short leg run state athlet assassin sort doubt whether anybodi could find convict settlement sequah thirti mile countri wild tangl enough countri beyond sure sens go,chesterton-brown.txt
voic heard talk room though door open todhunt alway found alon tale mysteri tall man silk hat came seamist appar sea step softli across sandi field small back garden twilight till heard talk lodger open window colloquy seem end quarrel todhunt dash window violenc man high hat melt seafog stori told famili fiercest mystif realli think mr macnab prefer origin tale man whatev crawl everi night big box corner kept lock day see therefor seal door todhunt treat gate fanci monstros thousand one night yet littl fellow respect black jacket punctual innoc parlour clock pay rent tick practic teetotal tirelessli kind younger children keep amus day end last urgent made equal popular eldest daughter readi go church tomorrow man warmli concern larg theori alway relish appli trivial great specialist condescend priest simplic condescend expans settl comfort armchair began talk tone somewhat absentmind lectur even minut instanc best look first main,chesterton-brown.txt
tramp street edg town outrag need fear dont know mean take may trust eye never met man accur describ meet way brown said bite finger rather nervouslyi realli dark see properli bandstand affair im afraid didnt describ accur pincenez broken long gold pin wasnt stuck purpl scarf heart suppos said lower voic glassey guy someth hope littl answer brown rather troubl voic may wrong act impuls fear busi deep root dark walk street silenc yellow lamp begin lit cold blue twilight evid approach central part town highli colour bill announc glovefight nigger ned malvoli slap wall well said flambeau never murder anyon even crimin day almost sympath anyon dreari place godforsaken dustbin natur think heartbreak place like bandstand meant festiv forlorn fanci morbid man feel must kill rival solitud ironi scene rememb take tramp gloriou surrey hill think noth gors skylark came vast circl land lift vast voiceless structur tier,chesterton-brown.txt
look trace burglar appear strike ground hand anger find see thu quadruped grass priest rais eyebrow rather sadli first time guess fanci thing might euphem third item group cook epicur also known father brown audrey watson major ward housekeep moment judg apron tuckedup sleev resolut manner much housekeep ward serv right say alway told oldfashion cruetstand prefer said putnam placabl im oldfashion thing keep togeth vanish togeth see retort well go bother burglar shouldnt bother lunch sunday cant send vinegar town indian gentlemen cant enjoy call dinner without lot hot thing wish good hadnt ask cousin oliv take music servic isnt till halfpast twelv colonel leav dont believ men manag alon oh ye dear said major look amiabl marco sauc weve often done well rough place might know time treat audrey mustnt housekeep everi hour day know want hear music want go church said rather sever eye one handsom women,chesterton-brown.txt
laugh laugh repeat doctor start earth laugh well repli reverend brown apologet put fine point think laugh inde im littl inclin laugh know know ask hood exasper know repli priest profess mr todhunt shuffl room look one object anoth seem vacant stare invari burst equal vacant laugh highli irrit process watch laugh much hat still uproari broken glass blood sword point sent mortal convuls amus turn fume specialist dr hood cri enthusiast great poet call uncreat void much godlik ferret mere fact inde mere fact rather commonplac comic comparison notion talk said dr hood rather haughtili fact inevit though necessarili incomplet place may permit intuit perhap poetri prefer term correspond detail yet ascertain absenc mr glass that that said littl priest nod quit eagerli that first idea get fix absenc mr glass extrem absent suppos ad reflect never anybodi absent mr glass mean absent town demand doctor mean absent everywher,chesterton-brown.txt
case anyth matter major look rather queerli goodhumour gooseberri eye think nois ask sound like gun someth repli hesit seem singular sort echo major still look quietli protrud eye front door flung open releas flood gaslight face fade mist anoth figur pyjama sprang tumbl garden figur much longer leaner athlet pyjama though equal tropic compar tast white light lemonyellow stripe man haggard handsom sunburn aquilin profil rather deepsunken eye slight air odditi aris combin coalblack hair much lighter moustach father brown absorb detail leisur moment saw one thing man revolv hand cray exclaim major stare fire shot ye retort blackhair gentleman hotli would place chase everywher devil nearli major seem interven rather hurriedli friend father brown said brown dont know whether youv met colonel cray royal artilleri heard cours said priest innoc youdid hit anyth thought answer cray graviti ask major putnam lower voic fall cri anyth colonel cray regard,chesterton-brown.txt
time made theyr polish surfac like glass steel polish surfac halfway blade sword whose print earthli clue anybodi hold sword halfway long sword length advantag lung enemi least enemi enemi except one except one repeat one enemi said father brown easier kill dagger sword know said woman oneself long silenc priest said quietli abruptli right sir claud kill ye said face like marbl saw die said father brown love extraordinari express flash across face differ piti modesti remors anyth companion expect voic becam suddenli strong full dont believ said ever care rap hate husband ask turn round face sky ladi hate husband becauseit strang hardli know say itbecaus ye said brown patient husband wouldnt hate father brown nod seem still listen differ detect fact fiction small point never pretend understand understood perfectli well mr boulnoi drew near contain glow certainti husband said great man sir claud champion great man celebr,chesterton-brown.txt
see ran rifl friend one pinch powder enemi rifl rank close even mountain path cri would bring soldier rush hill say noth fact wood ridg patrol regular interv rifl far away dim wood dwarf distanc beyond river enemi could slink town detour round palac rifl west door east door north door south along four facad link safe clear crest ridg found nake nest old enemi found small platform rock broken abruptli three corner precipic behind black cave mask green thorn low hard believ man could enter front fall cliff vast cloudi vision valley small rock platform stood old bronz lectern readingstand groan great german bibl bronz copper grown green eat air exalt place otto instantli thought even arm must rust moonris alreadi made deathli dawn behind crest crag rain ceas behind lectern look across valley stood old man black robe fell straight cliff around whose white hair weak voic seem,chesterton-brown.txt
