partition,book
oh doct sigh hart sore chargd gent would haue heart bosom digniti whole bodi doct well well well gent pray god sir doct diseas beyond practis yet haue known haue walkt sleep haue dy holili bed lad wash hand put nightgown look pale tell yet again banquo buri come on graue doct euen ladi bed bed there knock gate come come come come giue hand what done vndone bed bed bed exit ladi doct go bed gent directli doct foul whispr abroad vnnatural deed breed vnnatural troubl infect mind deaf pillow discharg secret need diuin physitian god god forgiu vs look remou mean annoy still keep eye vpon goodnight mind mate amazd sight think dare speak gent good night good doctor exeunt scena secunda drum colour enter menteth cathn angu lenox soldier ment english powr neer led malcolm vnkle seyward good macduff reueng burn deer caus would bleed grim alarm,shakespeare-macbeth.txt
heer malc countryman yet know macd euer gentl cozen welcom hither malc know good god betim remou mean make vs stranger ross sir amen macd stand scotland ross ala poor countrey almost affraid know self calld mother graue noth know noth seen smile sigh groan shriek rent ayr made markd violent sorrow seem modern extasi deadman knell scars askd good men liue expir flower cap die ere sicken macd oh relat nice yet true malc what newest grief ross hour age doth hiss speaker minut teem new one macd do wife ross well macd children ross well macd tyrant batterd peac ross wel peac leaue em macd niggard speech gost ross came hither transport tyde haue heauili born ran rumour mani worthi fellow beleef witnest rather saw tyrant power afoot time help eye scotland would creat soldiour make women fight doff dire distress malc beet comfort com thither graciou england,shakespeare-macbeth.txt
thou lyst thou shaggeeard villain mur egg yong fri treacheri son killd mother run away pray exit cri murther scaena tertia enter malcolm macduff mal let vs seek desol shade weep sad bosom empti macd let vs rather hold fast mortal sword like good men bestrid downfal birthdom new morn new widdow howl new orphan cri new sorow strike heauen face resound felt scotland yelld like syllabl dolour mal beleeu ile wail know beleeu redress shall find time friend wil haue spoke may perchanc tyrant whose sole name blister tongu thought honest haue loud well hath touchd yet yong someth may discern wisedom offer vp weak poor innoc lamb appeas angri god macd treacher malc macbeth good vertuou natur may recoyl imperial charg shall craue pardon thought transpos angel bright still though brightest fell though thing foul would wear brow grace yet grace must still look macd haue lost hope,shakespeare-macbeth.txt
oh doct sigh hart sore chargd gent would haue heart bosom digniti whole bodi doct well well well gent pray god sir doct diseas beyond practis yet haue known haue walkt sleep haue dy holili bed lad wash hand put nightgown look pale tell yet again banquo buri come on graue doct euen ladi bed bed there knock gate come come come come giue hand what done vndone bed bed bed exit ladi doct go bed gent directli doct foul whispr abroad vnnatural deed breed vnnatural troubl infect mind deaf pillow discharg secret need diuin physitian god god forgiu vs look remou mean annoy still keep eye vpon goodnight mind mate amazd sight think dare speak gent good night good doctor exeunt scena secunda drum colour enter menteth cathn angu lenox soldier ment english powr neer led malcolm vnkle seyward good macduff reueng burn deer caus would bleed grim alarm,shakespeare-macbeth.txt
hath lent vs good seyward ten thousand men older better souldier none christendom giue ross would could answer comfort like haue word would howld desert ayr hear latch macd concern general caus feegrief due singl brest ross mind that honest share woe though main part pertain alon macd mine keep quickli let haue ross let ear dispis tongu euer shall possess heauiest sound euer yet heard macd humh guess ross castl surprizd wife babe sauag slaughterd relat manner quarri murtherd deer add death malc merciful heauen man nere pull hat vpon brow giue sorrow word grief do speak whisper orefraught heart bid break macd children ro wife children seruant could found macd must thenc wife kild ross haue said malc comfort let make vs medcin great reueng cure deadli greef macd children pretti one say oh hellkit pretti chicken damm one fell swoop malc disput like man macd shall must,shakespeare-macbeth.txt
thou lyst thou shaggeeard villain mur egg yong fri treacheri son killd mother run away pray exit cri murther scaena tertia enter malcolm macduff mal let vs seek desol shade weep sad bosom empti macd let vs rather hold fast mortal sword like good men bestrid downfal birthdom new morn new widdow howl new orphan cri new sorow strike heauen face resound felt scotland yelld like syllabl dolour mal beleeu ile wail know beleeu redress shall find time friend wil haue spoke may perchanc tyrant whose sole name blister tongu thought honest haue loud well hath touchd yet yong someth may discern wisedom offer vp weak poor innoc lamb appeas angri god macd treacher malc macbeth good vertuou natur may recoyl imperial charg shall craue pardon thought transpos angel bright still though brightest fell though thing foul would wear brow grace yet grace must still look macd haue lost hope,shakespeare-macbeth.txt
honor flatter stream make face vizard heart disguis ladi must leaue macb full scorpion mind dear wife thou knowst banquo flean liue ladi natur coppi etern macb there comfort yet assail thou iocund ere bat hath flown cloysterd flight ere black heccat summon shardborn beetl drowsi hum hath rung night yawn peal shall done deed dreadful note ladi what done macb innoc knowledg dearest chuck till thou applaud deed come seel night skarf vp tender eye pittiful day thi bloodi inuis hand cancel tear piec great bond keep pale light thicken crow make wing toth rooki wood good thing day begin droop drows while night black agent prey doe rows thou maruellst word hold thee still thing bad begun make strong themselu ill prythe goe exeunt scena tertia enter three murther bid thee ioyn vs macbeth need mistrust sinc deliuer offic haue doe direct iust stand vs west yet glimmer,shakespeare-macbeth.txt
exit seruant yesterday spoke togeth murth pleas highness macb well haue considerd speech know time past held vnder fortun thought innoc self made good last confer past probat born hand crost instrument wrought thing els might half soul notion crazd say thu banquo murth made known vs macb went point second meet doe find patienc predomin natur let goe gospelld pray good man issu whose heauie hand hath bowd graue beggerd euer murth men lieg macb catalogu ye goe men hound greyhound mungrel spaniel curr showgh waterrug demywolu clipt name dogg valu file distinguish swift slow subtl housekeep hunter eueri one accord gift bounteou natur hath closd wherebi receiu particular addit bill write alik men haue station file ith worst rank manhood sayt put business bosom whose execut take enemi grappl heart loue vs wear health sickli life death perfect murth one lieg vile blow buffet world hath incensd reckless,shakespeare-macbeth.txt
seruant ladi banquo gone court seruant madam return again night ladi say king would attend leysur word seruant madam enter ladi nought all spent desir got without content ti safer destroy destruct dwell doubtful ioy enter macbeth lord doe keep alon sorryest fanci companion make vsing thought inde haue dyd think thing without remedi without regard what done done macb haue scorchd snake killd sheel close self whilest poor mallic remain danger former tooth let frame thing disioynt world suffer ere eat meal fear sleep afflict terribl dream shake vs nightli better dead gayn peac haue sent peac tortur mind lye restless extasi duncan graue life fitful feuer sleep well treason done worst steel poyson mallic domestiqu forrain leuie noth touch ladi come gentl lord sleek ore rug look bright iouiall among guest night macb shall loue pray let remembr appli banquo present emin eye tongu vnsafe wee must laue,shakespeare-macbeth.txt
kill father flean peac broad word caus fayld presenc tyrant feast hear macduff liue disgrac sir tell bestow himself lord sonn duncan tyrant hold due birth liue english court receyud piou edward grace maleuol fortun noth take high respect thither macduff gone pray holi king vpon ayd wake northumberland warlik seyward help abou ratifi work may again giue tabl meat sleep night free feast banquet bloodi kniue faithful homag receiu free honor pine report hath exasper king hee prepar attempt warr len sent macduff lord absolut sir clowdi messeng turn back hum say youl rue time clogg answer lenox well might aduis caution hold distanc wisedom prouid holi angel flye court england vnfold messag ere come swift bless may soon return suffer countri vnder hand accursd lord ile send prayer exeunt actu quartu scena prima thunder enter three witch thrice brind cat hath mewd thrice hedgepigg whind harpier cri ti,shakespeare-macbeth.txt
exit seruant yesterday spoke togeth murth pleas highness macb well haue considerd speech know time past held vnder fortun thought innoc self made good last confer past probat born hand crost instrument wrought thing els might half soul notion crazd say thu banquo murth made known vs macb went point second meet doe find patienc predomin natur let goe gospelld pray good man issu whose heauie hand hath bowd graue beggerd euer murth men lieg macb catalogu ye goe men hound greyhound mungrel spaniel curr showgh waterrug demywolu clipt name dogg valu file distinguish swift slow subtl housekeep hunter eueri one accord gift bounteou natur hath closd wherebi receiu particular addit bill write alik men haue station file ith worst rank manhood sayt put business bosom whose execut take enemi grappl heart loue vs wear health sickli life death perfect murth one lieg vile blow buffet world hath incensd reckless,shakespeare-macbeth.txt
malc perchanc euen find doubt rawness left wife child preciou motiu strong knot loue without leauetak pray let iealousi dishonor mine own safeti may rightli iust euer shall think macd bleed bleed poor countri great tyrrani lay thou thi basi sure goodness dare check thee wear thi wrong titl affeard far thee well lord would villain thou thinkst whole space that tyrant grasp rich east boot mal offend speak absolut fear think countri sink beneath yoak weep bleed new day gash ad wound think withal would hand vplift right heer graciou england haue offer goodli thousand shall tread vpon tyrant head wear sword yet poor countri shall haue vice suffer sundri way euer shall succeed macd mal self mean know particular vice graft shall opend black macbeth seem pure snow poor state esteem lamb compard confineless harm macd legion horrid hell come diuell damnd euil top macbeth mal grant bloodi,shakespeare-macbeth.txt
heauen cherubin horsd vpon sightless currior ayr shall blow horrid deed eueri eye tear shall drown wind haue spurr prick side intent one vault ambit oreleap self fall th enter ladi new la almost supt haue left chamber mac hath askd la know mac proceed business hath honourd late haue bought golden opinion sort peopl would worn newest gloss cast asid soon la hope drunk wherein drest self hath slept sinc wake look green pale freeli time account thi loue art thou affeard thine own act valour thou art desir wouldst thou haue thou esteemst ornament life liue coward thine own esteem let dare wait vpon would like poor cat ith addag macb prythe peac dare may becom man dare none la beast wast made break enterpr durst man would much man time place adher yet would make haue made themselu fitness do vnmake haue giuen suck know tender ti,shakespeare-macbeth.txt
seyt ti need yet macb ile put send moe hors skirr countri round hang talk fear giue mine armor do patient doctor doct sick lord troubl thickecom fanci keep rest macb cure canst thou minist mind diseasd pluck memori root sorrow raze written troubl brain sweet obliuiou antidot cleans stufft bosom peril stuff weigh vpon heart doct therein patient must minist himself macb throw physick dog ile none come put mine armour giue staff seyton send doctor thane flye come sir dispatch thou couldst doctor cast water land find diseas purg sound pristin health would applaud thee eccho applaud again pullt say rubarb cyme purgatiu drugg would scowr english henc hearst doct good lord royal prepar make vs hear someth macb bring affraid death bane till birnan forrest come dunsinan doct dunsinan away cleer profit again hardli draw heer exeunt scena quarta drum colour enter malcolm seyward macduff seyward sonn,shakespeare-macbeth.txt
farwel till vnseamd naue toth chop fixd head vpon battlement king valiant cousin worthi gentleman cap whenc sunn gin reflect shipwrack storm direful thunder spring whenc comfort seemd come discomfort swell mark king scotland mark sooner iustic valour armd compelld skip kern trust heel norweyan lord suruey vantag furbusht arm new supply men began fresh assault king dismayd captain macbeth banquoh cap ye sparrow eagl hare lyon say sooth must report cannon ouerchargd doubl crack doubli redoubl stroak vpon foe except meant bath reek wound memor anoth golgotha tell faint gash cri help king well thi word becom thee thi wound smack honor goe get surgeon enter ross angu come mal worthi thane ross lenox hast look eye look seem speak thing strang ross god saue king king whenc camst thou worthi thane ross fiff great king norweyan banner flowt skie fann peopl cold norway himself terribl number assist disloyal,shakespeare-macbeth.txt
thou lyst thou shaggeeard villain mur egg yong fri treacheri son killd mother run away pray exit cri murther scaena tertia enter malcolm macduff mal let vs seek desol shade weep sad bosom empti macd let vs rather hold fast mortal sword like good men bestrid downfal birthdom new morn new widdow howl new orphan cri new sorow strike heauen face resound felt scotland yelld like syllabl dolour mal beleeu ile wail know beleeu redress shall find time friend wil haue spoke may perchanc tyrant whose sole name blister tongu thought honest haue loud well hath touchd yet yong someth may discern wisedom offer vp weak poor innoc lamb appeas angri god macd treacher malc macbeth good vertuou natur may recoyl imperial charg shall craue pardon thought transpos angel bright still though brightest fell though thing foul would wear brow grace yet grace must still look macd haue lost hope,shakespeare-macbeth.txt
farwel exit banquo let eueri man master time till seuen night make societi sweeter welcom keep self till supper time alon god exeunt lord sirrha word attend men pleasur seruant lord without pallac gate macb bring vs exit seruant thu noth safe thu fear banquo stick deep royalti natur reign would feard ti much dare dauntless temper mind hath wisdom doth guid valour act safeti none whose doe fear vnder geniu rebukd said mark anthoni caesar chid sister first put name king vpon bad speak prophetlik hayld father line king vpon head placd fruitless crown put barren scepter gripe thenc wrencht vnlineal hand sonn mine succeed ift banquo issu haue fild mind graciou duncan haue murtherd put rancour vessel peac one mine eternal iewel giuen common enemi man make king seed banquo king rather come fate lyst champion th vtteranc who enter seruant two murther goe door stay till call,shakespeare-macbeth.txt
wait appetit health lenox mayt pleas highness sit macb countri honor roofd gracd person banquo present may rather challeng vnkindness pitti mischanc ross absenc sir lay blame vpon promis pleast highness grace vs royal compani macb tabl full lenox heer place reserud sir macb lenox heer good lord ist moue highness macb haue done lord good lord macb thou canst say neuer shake thi goari lock ross gentlemen rise highness well ladi sit worthi friend lord often thu hath been youth pray keep seat fit momentari vpon thought again well much note shall offend extend passion feed regard man macb bold one dare look might appal diuell la proper stuff paint fear ayredrawnedagg said led duncan flaw start impostor true fear would well becom woman stori winter fire authorizd grandam shame self make face all done look stool macb prythe see behold look loe say care thou canst nod speak,shakespeare-macbeth.txt
ere come ground distilld magick slight shall rais artificial spright strength illus shall draw confus shall spurn fate scorn death bear hope boue wisedom grace fear know secur mortal cheefest enemi musick song heark calld littl spirit see sit foggi cloud stay sing within come away come away c come let make hast sheel soon back again exeunt scaena sexta enter lenox anoth lord lenox former speech haue hit thought interpret farther one say thing haue bin strang born graciou duncan pitti macbeth marri dead right valiant banquo walkd late may say ift pleas flean killd flean fled men must walk late want thought monstrou malcolm donalban kill graciou father damn fact greeue macbeth straight piou rage two delinqu tear slaue drink thrall sleep nobli done wise twould haue angerd heart aliu hear men denyt say born thing well think duncan sonn vnder key andt pleas heauen shall find twere,shakespeare-macbeth.txt
hath lent vs good seyward ten thousand men older better souldier none christendom giue ross would could answer comfort like haue word would howld desert ayr hear latch macd concern general caus feegrief due singl brest ross mind that honest share woe though main part pertain alon macd mine keep quickli let haue ross let ear dispis tongu euer shall possess heauiest sound euer yet heard macd humh guess ross castl surprizd wife babe sauag slaughterd relat manner quarri murtherd deer add death malc merciful heauen man nere pull hat vpon brow giue sorrow word grief do speak whisper orefraught heart bid break macd children ro wife children seruant could found macd must thenc wife kild ross haue said malc comfort let make vs medcin great reueng cure deadli greef macd children pretti one say oh hellkit pretti chicken damm one fell swoop malc disput like man macd shall must,shakespeare-macbeth.txt
seyt ti need yet macb ile put send moe hors skirr countri round hang talk fear giue mine armor do patient doctor doct sick lord troubl thickecom fanci keep rest macb cure canst thou minist mind diseasd pluck memori root sorrow raze written troubl brain sweet obliuiou antidot cleans stufft bosom peril stuff weigh vpon heart doct therein patient must minist himself macb throw physick dog ile none come put mine armour giue staff seyton send doctor thane flye come sir dispatch thou couldst doctor cast water land find diseas purg sound pristin health would applaud thee eccho applaud again pullt say rubarb cyme purgatiu drugg would scowr english henc hearst doct good lord royal prepar make vs hear someth macb bring affraid death bane till birnan forrest come dunsinan doct dunsinan away cleer profit again hardli draw heer exeunt scena quarta drum colour enter malcolm seyward macduff seyward sonn,shakespeare-macbeth.txt
menteth cathn angu soldier march malc cosin hope day neer hand chamber safe ment doubt noth seyw wood vs ment wood birnan malc let eueri souldier hew down bough beart therebi shall shadow number hoast make discoueri err report vs sold shall done syw learn confid tyrant keep still dunsinan indur set down befort malc ti main hope aduantag giuen less haue giuen reuolt none seru constrain thing whose heart absent macd let iust censur attend true euent put industri souldiership sey time approach due decis make vs know shall say haue owe thought speculatiu vnsure hope relat certain issu stroak must arbitr toward aduanc warr exeunt march scena quinta enter macbeth seyton souldier drum colour macb hang banner outward wall cri still come castl strength laugh siedg scorn heer let lye till famin agu eat vp forcd might haue met dareful beard beard beat backward home noys cri within,shakespeare-macbeth.txt
wife son traitor wife one swear lye son traitor wife eueri one do traitor must hangd son must hangd swear lye wife eueri one son must hang wife honest men son liar swearer fool lyar swearer enow beat honest men hang vp wife god help thee poor monki wilt thou father son dead yould weep would good sign quick haue new father wife poor pratler thou talkst enter messeng me bless fair dame known though state honor perfect doubt danger do approach neer take home man aduic found heer henc littl one fright thu think sauag wors fell cruelti nie person heauen preseru dare abid longer exit messeng wife whether flye haue done harm rememb earthli world harm often laudabl good sometim account danger folli ala put vp womanli defenc say haue done harm face enter murther mur husband wife hope place vnsanctifi thou mayst find mur he traitor son,shakespeare-macbeth.txt
great predict nobl hau royal hope seem wrapt withal speak look seed time say grain grow speak neyther begg fear fauor hate hayl hayl hayl lesser macbeth greater happi yet much happyer thou shalt get king though thou none hail macbeth banquo banquo macbeth hail macb stay imperfect speaker tell sinel death know thane glami cawdor thane cawdor liue prosper gentleman king stand within prospect beleef cawdor say whenc owe strang intellig vpon blast heath stop way prophetiqu greet speak charg witch vanish banq earth hath bubbl water whither vanishd macb ayr seemd corporal melt breath wind would stayd banq thing doe speak haue eaten insan root take reason prison macb children shall king banq shall king macb thane cawdor went banq toth selfesam tune word who enter ross angu ross king hath happili receiud macbeth new thi success read thi personal ventur rebel sight wonder prays doe contend thine,shakespeare-macbeth.txt
excit mortifi man ang neer byrnan wood shall well meet way com cath know donalban brother len certain sir haue file gentri seyward sonn mani vnruff youth euen protest first manhood ment do tyrant cath great dunsinan strongli fortifi say hee mad other lesser hate call valiant furi certain buckl distemperd caus within belt rule ang do feel secret murther stick hand minut reuolt vpbraid faithbreach command moue one command noth loue do feel titl hang loos like giant robe vpon dwarfish theef ment shall blame pesterd sens recoyl start within do condemn self cath well march giue obedi ti truli owd meet medcin sickli weal pour countri purg drop vs lenox much need dew soueraign flower drown weed make march toward birnan exeunt march scaena tertia enter macbeth doctor attend macb bring report let flye till byrnan wood remou dunsinan taint fear what boy malcolm born woman spirit know,shakespeare-macbeth.txt
diminitiu bird fight yong one nest owl fear noth loue littl wisedom flight runn reason ross deerest cooz pray school self husband nobl wise iudici best know fit oth season dare speak much cruell time traitor know selu hold rumor fear yet know fear float vpon wild violent sea way moue take leaue shall long ile heer again thing worst ceas els climb vpward pretti cosin bless vpon wife fatherd yet hee fatherless ross much fool stay longer would disgrac discomfort take leaue exit ross wife sirra father dead liue son bird mother wife worm flye son get mean wife poor bird thoudst neuer fear net lime pitfal gin son mother poor bird set father dead say wife ye dead wilt thou father son nay husband wife buy twenti market son youl em sell again wife thou speakst withal thi wit yet ifaith wit enough thee son father traitor mother,shakespeare-macbeth.txt
thou lyst thou shaggeeard villain mur egg yong fri treacheri son killd mother run away pray exit cri murther scaena tertia enter malcolm macduff mal let vs seek desol shade weep sad bosom empti macd let vs rather hold fast mortal sword like good men bestrid downfal birthdom new morn new widdow howl new orphan cri new sorow strike heauen face resound felt scotland yelld like syllabl dolour mal beleeu ile wail know beleeu redress shall find time friend wil haue spoke may perchanc tyrant whose sole name blister tongu thought honest haue loud well hath touchd yet yong someth may discern wisedom offer vp weak poor innoc lamb appeas angri god macd treacher malc macbeth good vertuou natur may recoyl imperial charg shall craue pardon thought transpos angel bright still though brightest fell though thing foul would wear brow grace yet grace must still look macd haue lost hope,shakespeare-macbeth.txt
malcolm feet bait rabbl curs though byrnan wood come dunsinan thou opposd woman born yet tri last bodi throw warlik shield lay macduff damnd first cri hold enough exeunt fight alarum enter fight macbeth slain retreat flourish enter drumm colour malcolm seyward ross thane soldier mal would friend miss safe arriud sey must go yet see great day cheap bought mal macduff miss nobl sonn ross son lord paid souldier debt one liud till man sooner prowess confirmd vnshrink station fought like man dyde sey dead ross brought field caus sorrow must measurd worth hath end sey hurt ross front sey god soldier mani sonn haue hair would wish fairer death knell knolld mal hee worth sorrow ile spend sey he worth say part well paid score god come newer comfort enter macduff macbeth head macd hail king thou art behold stand th vsurper curs head time free see thee,shakespeare-macbeth.txt
